{
  "contract": "ONSURE_LEARNING_HISTORY_MIGRATION_CHECK_V1",
  "migration_id": "migration-knowledge-store-v3-to-v4",
  "subject_id": "learning-registry-financial-fraud",
  "categories": [
    {"category": "CANDIDATE_LIFECYCLE", "pre_migration_count": 412, "post_migration_count": 412},
    {"category": "LINEAGE", "pre_migration_count": 1893, "post_migration_count": 1893},
    {"category": "OLD_DECISIONS", "pre_migration_count": 5021, "post_migration_count": 5021},
    {"category": "REVOKED_ASSETS", "pre_migration_count": 37, "post_migration_count": 37},
    {"category": "QUALIFICATION_EVIDENCE", "pre_migration_count": 289, "post_migration_count": 291}
  ],
  "decision": "RECONSTRUCTABILITY_PRESERVED",
  "self_validation_nonfinal": true,
  "final_claim_allowed": false
}
